{
  "format": "aegisops-ingestion-v1",
  "telemetry": {
    "batch_id": "22222222-2222-4222-8222-222222222222",
    "batch_hash": "e93a81808cbc38e8146382ef2d9a57555bf9079ee896c429b74a9c5b5f4fde01",
    "collector_id": "local-kind-reader",
    "registration_id": "11111111-1111-4111-8111-111111111111",
    "cluster_id": "kind-aegisops-demo",
    "key_id": "5255da8abecab8218d451bd5a866e66e4b76e44b2d1a11f8856d1ed6145b255c"
  },
  "processed_at": "2026-10-15T12:00:00Z",
  "snapshot_count": 1,
  "incident_count": 1,
  "audit_run_ids": [
    "33333333-3333-4333-8333-333333333333"
  ],
  "status": "completed",
  "execution_performed": false
}
